[{"version":"v6.0.2-SNAPSHOT-pr1063-b617439","offset":6.5435,"offsets":{"c1":9.0394,"c2":4.0476},"n_measured":15,"n_compared":15,"mean_error":-3.0608,"std_error":4.1569,"rmse":5.1622,"max_abs_error":11.6511,"scatter":[[76.2,71.62,"c1"],[74.6,69.13,"c1"],[43.5,44.57,"c1"],[68.3,62.17,"c1"],[40.35,42.43,"c1"],[67.1,64.58,"c1"],[57.2,49.03,"c1"],[63.5,63.67,"c1"],[54.7,58.62,"c1"],[93.5,93.5,"c1"],[91.45,91.45,"c2"],[74.9,67.43,"c2"],[63.3,51.65,"c2"],[54.6,51.22,"c2"],[74.75,70.96,"c2"]],"bars":[[76.2,71.62,77.18,"c1"],[74.6,69.13,76.99,"c1"],[43.5,44.57,52.77,"c1"],[68.3,62.17,69.23,"c1"],[40.35,42.43,63.88,"c1"],[67.1,64.58,67.03,"c1"],[57.2,49.03,63.27,"c1"],[63.5,63.67,70.71,"c1"],[54.7,58.62,72.35,"c1"],[93.5,93.5,93.63,"c1"],[91.45,91.45,91.54,"c2"],[74.9,67.43,71.65,"c2"],[63.3,51.65,63.47,"c2"],[54.6,51.22,63.96,"c2"],[74.75,70.96,72.44,"c2"]],"receivers":[[1,345695.806,6686955.457,76.2,71.62,-4.58,"c1"],[2,345347.567,6687095.256,74.6,69.13,-5.47,"c1"],[3,344827.874,6687672.1,43.5,44.57,1.07,"c1"],[4,346060.43,6686803.28,68.3,62.17,-6.13,"c1"],[5,344679.284,6687419.129,40.35,42.43,2.08,"c1"],[6,345567.274,6687763.705,67.1,64.58,-2.52,"c1"],[7,346231.537,6686601.956,57.2,49.03,-8.17,"c1"],[8,345855.782,6686842.235,63.5,63.67,0.17,"c1"],[9,345043.943,6686991.045,54.7,58.62,3.92,"c1"],[10,345560.256,6687172.909,93.5,93.5,-0.0,"c1"],[11,345550.565,6687178.781,91.45,91.45,0.0,"c2"],[12,345708.889,6686945.334,74.9,67.43,-7.47,"c2"],[13,345953.32,6686782.293,63.3,51.65,-11.65,"c2"],[14,346120.637,6686657.928,54.6,51.22,-3.38,"c2"],[15,345724.101,6687123.119,74.75,70.96,-3.79,"c2"]],"campaigns":["c1","c2"],"campaign_labels":{"c1":"Campagne 1 (05/08/2026)","c2":"Campagne 2 (07/10/2026)"},"n_per_campaign":{"c1":10,"c2":5},"references":{"c1":{"receiver":10,"distance":25.42,"offset":9.0394,"measured":93.5,"computed":84.46},"c2":{"receiver":11,"distance":16.37,"offset":4.0476,"measured":91.45,"computed":87.4}}}]